{"dpi":300,"duration_ms":1223,"engine":"Vision.Document","routing":{"version":"1.0","tau_conf":0.55,"median_confidence":0.19747934807091952,"features":{"retry_lc":false,"tau_conf":true,"blank_guard":true,"columns_gate":true,"script_conflict":true}},"mode":"document","timestamp":"2025-10-22T21:15:08.797Z","schema_version":"1.2","xcode_version":"Xcode 26.0","lang":["en-US"],"input_path":"eobs\/tests\/AetnaW:Check.pdf","swift_version":"Apple Swift version 6.2 (swiftlang-6.2.0.19.9 clang-1700.3.19.1)","input_sha256":"ad6108271e45c9483abbdcc02d62b5add36ba11c92fd72dae38b1bc34f744bc2","pages":[{"duration_ms":443,"page_index":0,"tau_conf":0.55,"route":"vlm","line_count":55,"mean_confidence":0.28926968256180935,"crc32":"302127fd"},{"duration_ms":269,"page_index":1,"tau_conf":0.55,"route":"text","line_count":3,"mean_confidence":0.11110858370860417,"crc32":"c51293da"},{"duration_ms":297,"page_index":2,"tau_conf":0.55,"route":"vlm","line_count":30,"mean_confidence":0.2332663618028164,"crc32":"5ebabafa"},{"duration_ms":209,"page_index":3,"tau_conf":0.55,"route":"vlm","line_count":4,"mean_confidence":0.16169233433902264,"crc32":"35ac2ef8"}],"min_text_height":0.014999999664723873,"ndjson_path":"\/Users\/jryear\/Desktop\/NativeOCR\/bench\/v12\/AetnaW:Check.jsonl","macOS":"26.0.1","argv":["vision-ocr-cli\/.build\/release\/vision-ocr-cli","eobs\/tests\/AetnaW:Check.pdf","--dpi","300","--mode","document","--lang","en-US","--ndjson","bench\/v12\/AetnaW:Check.jsonl"],"revision":"RecognizeDocumentsRequestRevision1","page_count":4}