{"lang":["en-US"],"min_text_height":0.014999999664723873,"mode":"document","engine":"Vision.Document","mode_fallback":false,"duration_ms":1575,"dpi":300,"argv":["vision-ocr-cli\/.build\/release\/vision-ocr-cli","eobs\/tests\/DD_3.pdf","--dpi","300","--mode","document","--lang","en-US","--ndjson","bench\/stage_ab\/DD_3.jsonl"],"xcode_version":"Xcode 26.0","input_path":"eobs\/tests\/DD_3.pdf","ndjson_path":"\/Users\/jryear\/Desktop\/NativeOCR\/bench\/stage_ab\/DD_3.jsonl","timestamp":"2025-10-22T21:53:07.878Z","revision":"RecognizeDocumentsRequestRevision1","routing":{"tau_conf":0.55,"version":"1.0","features":{"script_conflict":true,"blank_guard":true,"columns_gate":true,"retry_lc":false,"tau_conf":true},"median_confidence":0.39595165909969643},"page_count":3,"macOS":"26.0.1","schema_version":"1.2","pages":[{"crc32":"c179acfc","route":"vlm","tau_conf":0.55,"mean_confidence":0.44567485914255184,"line_count":48,"duration_ms":774,"page_index":0},{"crc32":"11f50fc8","route":"vlm","tau_conf":0.55,"mean_confidence":0.39595165909969643,"line_count":73,"duration_ms":398,"page_index":1},{"crc32":"ed864df7","route":"vlm","tau_conf":0.55,"mean_confidence":0.386819336224686,"line_count":22,"duration_ms":398,"page_index":2}],"input_sha256":"4098b6818705feb049d4a1c8ee3beaec4afba1c494cf4a200c034be4673326eb","swift_version":"Apple Swift version 6.2 (swiftlang-6.2.0.19.9 clang-1700.3.19.1)"}