{"revision":"RecognizeDocumentsRequestRevision1","macOS":"26.0.1","swift_version":"Apple Swift version 6.2 (swiftlang-6.2.0.19.9 clang-1700.3.19.1)","input_sha256":"4098b6818705feb049d4a1c8ee3beaec4afba1c494cf4a200c034be4673326eb","min_text_height":0.014999999664723873,"xcode_version":"Xcode 26.0","pages":[{"page_index":0,"crc32":"c179acfc","route":"vlm","mean_confidence":0.44567485914255184,"line_count":48,"tau_conf":0.55,"duration_ms":488},{"page_index":1,"crc32":"11f50fc8","route":"vlm","mean_confidence":0.39595165909969643,"line_count":73,"tau_conf":0.55,"duration_ms":376},{"page_index":2,"crc32":"ed864df7","route":"vlm","mean_confidence":0.386819336224686,"line_count":22,"tau_conf":0.55,"duration_ms":241}],"schema_version":"1.2","dpi":300,"timestamp":"2025-10-22T21:13:45.531Z","lang":["en-US"],"argv":["vision-ocr-cli\/.build\/release\/vision-ocr-cli","eobs\/tests\/DD_3.pdf","--dpi","300","--mode","document","--lang","en-US","--ndjson","\/tmp\/dd3_v12.jsonl","--log-run","runs\/dd3_v12.json"],"ndjson_path":"\/tmp\/dd3_v12.jsonl","duration_ms":1110,"input_path":"eobs\/tests\/DD_3.pdf","routing":{"features":{"script_conflict":true,"blank_guard":true,"retry_lc":false,"tau_conf":true,"columns_gate":true},"version":"1.0","tau_conf":0.55,"median_confidence":0.39595165909969643},"page_count":3,"engine":"Vision.Document","mode":"document"}