{"ndjson_crc32":"439c9d24","swift_version":"Apple Swift version 6.2 (swiftlang-6.2.0.19.9 clang-1700.3.19.1)","input_path":"eobs\/tests\/DD_3.pdf","mode_fallback":false,"ndjson_line_count":1,"vlm_runs":[{"page_index":0,"response_path":"\/Users\/jryear\/Desktop\/NativeOCR\/runs\/vlm\/4098b6818705feb049d4a1c8ee3beaec4afba1c494cf4a200c034be4673326eb_p0_roi0_response.json","image_path":"\/Users\/jryear\/Desktop\/NativeOCR\/runs\/vlm\/4098b6818705feb049d4a1c8ee3beaec4afba1c494cf4a200c034be4673326eb_p0_roi0.png","response_crc32":"dab96ca6","request_path":"\/Users\/jryear\/Desktop\/NativeOCR\/runs\/vlm\/4098b6818705feb049d4a1c8ee3beaec4afba1c494cf4a200c034be4673326eb_p0_roi0_request.json","roi_id":"page","runner_status":"ok","request_crc32":"ac0ff98e"}],"routing":{"features":{"columns_gate":true,"script_conflict":true,"tau_conf":true,"blank_guard":true,"retry_lc":false},"version":"1.0","tau_conf":0.7887755119070714,"median_confidence":0.8387755119070714},"timestamp":"2025-10-22T23:54:52.358Z","schema_version":"1.2","macOS":"26.0.1","mode":"text","lang":["en-US"],"min_text_height":0.014999999664723873,"pages":[{"crc32":"1c172ac5","duration_ms":480,"page_index":0,"route":"vlm","mean_confidence":0.8387755119070714,"line_count":49,"tau_conf":0.7887755119070714}],"xcode_version":"Xcode 26.0","dpi":72,"page_count":1,"revision":"VNRecognizeTextRequestRevision3","engine":"Vision","ndjson_path":"\/Users\/jryear\/Desktop\/NativeOCR\/bench\/raw_doc\/smoke_vlm.jsonl","argv":["vision-ocr-cli\/.build\/release\/vision-ocr-cli","eobs\/tests\/DD_3.pdf","--dpi","72","--mode","text","--lang","en-US","--pages","0:1","--ndjson","bench\/raw_doc\/smoke_vlm.jsonl","--log-run","runs\/smoke_vlm_run.json","--vlm-runner","scripts\/vlm-noop.py","--vlm-export","runs\/vlm"],"input_sha256":"4098b6818705feb049d4a1c8ee3beaec4afba1c494cf4a200c034be4673326eb","duration_ms":514}