{"schema_version":"1.2","input_path":"eobs\/tests\/DD_3.pdf","vlm_runs":[{"image_path":"\/tmp\/vlm_exports\/4098b6818705feb049d4a1c8ee3beaec4afba1c494cf4a200c034be4673326eb_p0_roi0.png","page_index":0,"request_path":"\/tmp\/vlm_exports\/4098b6818705feb049d4a1c8ee3beaec4afba1c494cf4a200c034be4673326eb_p0_roi0_request.json","roi_id":"table_0","runner_status":"skipped"}],"page_count":1,"min_text_height":0.014999999664723873,"engine":"Vision.Document","macOS":"26.0.1","revision":"RecognizeDocumentsRequestRevision1","ndjson_path":"<stdout>","mode":"document","timestamp":"2025-10-22T21:14:27.060Z","routing":{"version":"1.0","tau_conf":0.55,"median_confidence":0.44567485914255184,"features":{"retry_lc":false,"tau_conf":true,"blank_guard":true,"script_conflict":true,"columns_gate":true}},"xcode_version":"Xcode 26.0","swift_version":"Apple Swift version 6.2 (swiftlang-6.2.0.19.9 clang-1700.3.19.1)","duration_ms":462,"lang":["en-US"],"input_sha256":"4098b6818705feb049d4a1c8ee3beaec4afba1c494cf4a200c034be4673326eb","dpi":300,"argv":["vision-ocr-cli\/.build\/release\/vision-ocr-cli","eobs\/tests\/DD_3.pdf","--dpi","300","--mode","document","--lang","en-US","--vlm-export","\/tmp\/vlm_exports","--pages","0:1"],"pages":[{"duration_ms":454,"page_index":0,"tau_conf":0.55,"mean_confidence":0.44567485914255184,"route":"vlm","crc32":"c179acfc","line_count":48}]}