{"xcode_version":"Xcode 26.0","input_sha256":"48a83b1144db6218cfc7d3fa44c02441230f622c81d604f9ed5058a7c969d0da","duration_ms":1030,"engine":"Vision.Document","page_count":3,"ndjson_path":"\/Users\/jryear\/Desktop\/NativeOCR\/bench\/v12\/DD_3_Ohio.jsonl","dpi":300,"timestamp":"2025-10-22T21:15:11.538Z","min_text_height":0.014999999664723873,"macOS":"26.0.1","schema_version":"1.2","mode":"document","routing":{"tau_conf":0.55,"median_confidence":0.30139279418757986,"version":"1.0","features":{"columns_gate":true,"retry_lc":false,"script_conflict":true,"tau_conf":true,"blank_guard":true}},"lang":["en-US"],"argv":["vision-ocr-cli\/.build\/release\/vision-ocr-cli","eobs\/tests\/DD_3_Ohio.pdf","--dpi","300","--mode","document","--lang","en-US","--ndjson","bench\/v12\/DD_3_Ohio.jsonl"],"pages":[{"tau_conf":0.55,"duration_ms":450,"page_index":0,"route":"vlm","line_count":53,"crc32":"62da88c9","mean_confidence":0.32070122181244615},{"tau_conf":0.55,"duration_ms":340,"page_index":1,"route":"vlm","line_count":56,"crc32":"0211c172","mean_confidence":0.30139279418757986},{"tau_conf":0.55,"duration_ms":236,"page_index":2,"route":"text","line_count":24,"crc32":"2508abe7","mean_confidence":0.2675864303795}],"revision":"RecognizeDocumentsRequestRevision1","swift_version":"Apple Swift version 6.2 (swiftlang-6.2.0.19.9 clang-1700.3.19.1)","input_path":"eobs\/tests\/DD_3_Ohio.pdf"}