{"ndjson_path":"\/Users\/jryear\/Desktop\/NativeOCR\/bench\/smoke\/output.jsonl","schema_version":"1.2","argv":["vision-ocr-cli\/.build\/release\/vision-ocr-cli","eobs\/tests\/DD_3.pdf","--dpi","72","--mode","text","--lang","en-US","--pages","0:1","--ndjson","bench\/smoke\/output.jsonl","--log-run","runs\/smoke_full_run.json","--vlm-runner","scripts\/vlm-noop.py","--vlm-export","runs\/smoke_vlm","--vlm-preprocess"],"ndjson_line_count":1,"mode":"text","duration_ms":519,"routing":{"median_confidence":0.8387755119070714,"version":"1.0","tau_conf":0.7887755119070714,"features":{"retry_lc":false,"tau_conf":true,"columns_gate":true,"script_conflict":true,"blank_guard":true}},"vlm_runs":[{"page_index":0,"request_crc32":"ad5b513f","preprocess_ops":["noop"],"response_path":"\/Users\/jryear\/Desktop\/NativeOCR\/runs\/smoke_vlm\/4098b6818705feb049d4a1c8ee3beaec4afba1c494cf4a200c034be4673326eb_p0_roi0_response.json","runner_status":"ok","image_path":"\/Users\/jryear\/Desktop\/NativeOCR\/runs\/smoke_vlm\/4098b6818705feb049d4a1c8ee3beaec4afba1c494cf4a200c034be4673326eb_p0_roi0_pre.png","request_path":"\/Users\/jryear\/Desktop\/NativeOCR\/runs\/smoke_vlm\/4098b6818705feb049d4a1c8ee3beaec4afba1c494cf4a200c034be4673326eb_p0_roi0_request.json","roi_id":"page","response_crc32":"dab96ca6"}],"macOS":"26.0.1","swift_version":"Apple Swift version 6.2 (swiftlang-6.2.0.19.9 clang-1700.3.19.1)","dpi":72,"input_sha256":"4098b6818705feb049d4a1c8ee3beaec4afba1c494cf4a200c034be4673326eb","timestamp":"2025-10-23T01:33:36.674Z","mode_fallback":false,"input_path":"eobs\/tests\/DD_3.pdf","revision":"VNRecognizeTextRequestRevision3","lang":["en-US"],"min_text_height":0.014999999664723873,"page_count":1,"pages":[{"page_index":0,"mean_confidence":0.8387755119070714,"tau_conf":0.7887755119070714,"crc32":"1c172ac5","duration_ms":471,"line_count":49,"route":"vlm"}],"engine":"Vision","ndjson_crc32":"82d8e63b","xcode_version":"Xcode 26.0"}