{"timestamp":"2025-10-23T01:19:36.488Z","argv":["vision-ocr-cli\/.build\/release\/vision-ocr-cli","eobs\/tests\/DD_3.pdf","--dpi","72","--mode","text","--lang","en-US","--pages","0:1","--ndjson","bench\/raw_doc\/smoke2.jsonl","--log-run","runs\/smoke2_run.json","--vlm-runner","scripts\/vlm-noop.py","--vlm-export","runs\/vlm","--vlm-preprocess"],"macOS":"26.0.1","dpi":72,"page_count":1,"engine":"Vision","swift_version":"Apple Swift version 6.2 (swiftlang-6.2.0.19.9 clang-1700.3.19.1)","min_text_height":0.014999999664723873,"lang":["en-US"],"routing":{"features":{"blank_guard":true,"tau_conf":true,"columns_gate":true,"script_conflict":true,"retry_lc":false},"tau_conf":0.7887755119070714,"version":"1.0","median_confidence":0.8387755119070714},"schema_version":"1.2","vlm_runs":[{"request_crc32":"41f11aa0","page_index":0,"image_path":"\/Users\/jryear\/Desktop\/NativeOCR\/runs\/vlm\/4098b6818705feb049d4a1c8ee3beaec4afba1c494cf4a200c034be4673326eb_p0_roi0.png","response_path":"\/Users\/jryear\/Desktop\/NativeOCR\/runs\/vlm\/4098b6818705feb049d4a1c8ee3beaec4afba1c494cf4a200c034be4673326eb_p0_roi0_response.json","roi_id":"page","request_path":"\/Users\/jryear\/Desktop\/NativeOCR\/runs\/vlm\/4098b6818705feb049d4a1c8ee3beaec4afba1c494cf4a200c034be4673326eb_p0_roi0_request.json","runner_status":"ok","response_crc32":"dab96ca6"}],"revision":"VNRecognizeTextRequestRevision3","pages":[{"line_count":49,"page_index":0,"tau_conf":0.7887755119070714,"crc32":"1c172ac5","route":"vlm","mean_confidence":0.8387755119070714,"duration_ms":441}],"duration_ms":480,"ndjson_path":"\/Users\/jryear\/Desktop\/NativeOCR\/bench\/raw_doc\/smoke2.jsonl","ndjson_crc32":"6a9c6f91","mode":"text","input_sha256":"4098b6818705feb049d4a1c8ee3beaec4afba1c494cf4a200c034be4673326eb","xcode_version":"Xcode 26.0","input_path":"eobs\/tests\/DD_3.pdf","ndjson_line_count":1,"mode_fallback":false}