{"argv":["vision-ocr-cli\/.build\/release\/vision-ocr-cli","eobs\/tests\/AetnaW:Check.pdf","--dpi","300","--mode","document","--lang","en-US","--ndjson","bench\/stage_ab\/AetnaW:Check.jsonl"],"mode":"document","page_count":4,"engine":"Vision.Document","swift_version":"Apple Swift version 6.2 (swiftlang-6.2.0.19.9 clang-1700.3.19.1)","duration_ms":1409,"min_text_height":0.014999999664723873,"xcode_version":"Xcode 26.0","schema_version":"1.2","timestamp":"2025-10-22T21:53:05.998Z","macOS":"26.0.1","routing":{"features":{"columns_gate":true,"retry_lc":false,"script_conflict":true,"blank_guard":true,"tau_conf":true},"tau_conf":0.55,"version":"1.0","median_confidence":0.19747934807091952},"pages":[{"page_index":0,"route":"vlm","line_count":55,"duration_ms":457,"tau_conf":0.55,"mean_confidence":0.28926968256180935,"crc32":"302127fd"},{"page_index":1,"route":"text","line_count":3,"duration_ms":341,"tau_conf":0.55,"mean_confidence":0.11110858370860417,"crc32":"c51293da"},{"page_index":2,"route":"vlm","line_count":30,"duration_ms":346,"tau_conf":0.55,"mean_confidence":0.2332663618028164,"crc32":"5ebabafa"},{"page_index":3,"route":"vlm","line_count":4,"duration_ms":260,"tau_conf":0.55,"mean_confidence":0.16169233433902264,"crc32":"35ac2ef8"}],"revision":"RecognizeDocumentsRequestRevision1","input_sha256":"ad6108271e45c9483abbdcc02d62b5add36ba11c92fd72dae38b1bc34f744bc2","input_path":"eobs\/tests\/AetnaW:Check.pdf","mode_fallback":false,"ndjson_path":"\/Users\/jryear\/Desktop\/NativeOCR\/bench\/stage_ab\/AetnaW:Check.jsonl","dpi":300,"lang":["en-US"]}