{"revision":"RecognizeDocumentsRequestRevision1","schema_version":"1.2","duration_ms":1461,"engine":"Vision.Document","timestamp":"2025-10-22T21:53:09.671Z","swift_version":"Apple Swift version 6.2 (swiftlang-6.2.0.19.9 clang-1700.3.19.1)","dpi":300,"argv":["vision-ocr-cli\/.build\/release\/vision-ocr-cli","eobs\/tests\/DD_3_Ohio.pdf","--dpi","300","--mode","document","--lang","en-US","--ndjson","bench\/stage_ab\/DD_3_Ohio.jsonl"],"ndjson_path":"\/Users\/jryear\/Desktop\/NativeOCR\/bench\/stage_ab\/DD_3_Ohio.jsonl","lang":["en-US"],"page_count":3,"mode_fallback":false,"pages":[{"crc32":"62da88c9","tau_conf":0.55,"line_count":53,"page_index":0,"duration_ms":837,"route":"vlm","mean_confidence":0.32070122181244615},{"crc32":"0211c172","tau_conf":0.55,"line_count":56,"page_index":1,"duration_ms":378,"route":"vlm","mean_confidence":0.30139279418757986},{"crc32":"2508abe7","tau_conf":0.55,"line_count":24,"page_index":2,"duration_ms":241,"route":"vlm","mean_confidence":0.2675864303795}],"input_path":"eobs\/tests\/DD_3_Ohio.pdf","mode":"document","input_sha256":"48a83b1144db6218cfc7d3fa44c02441230f622c81d604f9ed5058a7c969d0da","macOS":"26.0.1","xcode_version":"Xcode 26.0","min_text_height":0.014999999664723873,"routing":{"version":"1.0","tau_conf":0.55,"features":{"blank_guard":true,"tau_conf":true,"retry_lc":false,"script_conflict":true,"columns_gate":true},"median_confidence":0.30139279418757986}}