{"dpi":72,"ndjson_crc32":"cffdda87","routing":{"tau_conf":0.7887755119070714,"median_confidence":0.8387755119070714,"version":"1.0","features":{"blank_guard":true,"tau_conf":true,"columns_gate":true,"script_conflict":true,"retry_lc":false}},"argv":["vision-ocr-cli\/.build\/release\/vision-ocr-cli","eobs\/tests\/DD_3.pdf","--dpi","72","--mode","text","--lang","en-US","--pages","0:1","--ndjson","bench\/raw_doc\/smoke.jsonl","--log-run","runs\/smoke_run.json"],"input_sha256":"4098b6818705feb049d4a1c8ee3beaec4afba1c494cf4a200c034be4673326eb","lang":["en-US"],"min_text_height":0.014999999664723873,"xcode_version":"Xcode 26.0","swift_version":"Apple Swift version 6.2 (swiftlang-6.2.0.19.9 clang-1700.3.19.1)","duration_ms":491,"input_path":"eobs\/tests\/DD_3.pdf","page_count":1,"mode":"text","engine":"Vision","ndjson_line_count":1,"pages":[{"page_index":0,"duration_ms":490,"tau_conf":0.7887755119070714,"line_count":49,"crc32":"1c172ac5","route":"vlm","mean_confidence":0.8387755119070714}],"mode_fallback":false,"revision":"VNRecognizeTextRequestRevision3","macOS":"26.0.1","timestamp":"2025-10-22T23:52:49.550Z","schema_version":"1.2","ndjson_path":"\/Users\/jryear\/Desktop\/NativeOCR\/bench\/raw_doc\/smoke.jsonl"}