{"schema_version":"1.2","dpi":300,"engine":"Vision.Document","mode":"document","swift_version":"Apple Swift version 6.2 (swiftlang-6.2.0.19.9 clang-1700.3.19.1)","input_path":"eobs\/tests\/DD_3.pdf","argv":["vision-ocr-cli\/.build\/release\/vision-ocr-cli","eobs\/tests\/DD_3.pdf","--dpi","300","--mode","document","--lang","en-US","--ndjson","bench\/v12\/DD_3.jsonl"],"xcode_version":"Xcode 26.0","lang":["en-US"],"macOS":"26.0.1","page_count":3,"duration_ms":1109,"min_text_height":0.014999999664723873,"revision":"RecognizeDocumentsRequestRevision1","timestamp":"2025-10-22T21:15:10.209Z","routing":{"tau_conf":0.55,"median_confidence":0.39595165909969643,"features":{"script_conflict":true,"retry_lc":false,"tau_conf":true,"columns_gate":true,"blank_guard":true},"version":"1.0"},"pages":[{"duration_ms":463,"route":"vlm","line_count":48,"crc32":"c179acfc","page_index":0,"mean_confidence":0.44567485914255184,"tau_conf":0.55},{"duration_ms":393,"route":"vlm","line_count":73,"crc32":"11f50fc8","page_index":1,"mean_confidence":0.39595165909969643,"tau_conf":0.55},{"duration_ms":248,"route":"vlm","line_count":22,"crc32":"ed864df7","page_index":2,"mean_confidence":0.386819336224686,"tau_conf":0.55}],"ndjson_path":"\/Users\/jryear\/Desktop\/NativeOCR\/bench\/v12\/DD_3.jsonl","input_sha256":"4098b6818705feb049d4a1c8ee3beaec4afba1c494cf4a200c034be4673326eb"}